joe biden,all heart lost suffering virus bigger one us calls national rallying move laid detail president today can go joebidencom laid detail three pieces all care fact exposed exposed virus testing get testing kits ready
joe biden,health organization id advantage test kits us president coming get all tests can can secondly state union places drivethrough testing arrangements point deal plan additional hospital beds capacity department defense well fema can set hundredbed bed hospitals tents
joe biden,lay all deal economic fallout making people fact lose job dont get paycheck cant pay mortgage pay pay now now small businesses borrow interestfree loans time going hold us tightly assume go joebidencom lays precisely president today
bernie sanders,well thing got im president shut president now undermining doctors scientists help american people unacceptable blabbering unfactual confusing general public second all im glad called state national emergency got move aggressively person country finally understands get sick coronavirus all payments dont worry coming money testing dont worry coming money treatment
bernie sanders,unprecedented moment american history now medicare all fight president now emergency person country understand get sick go doctor get sick virus paid worry cost now middle national emergency
bernie sanders,second all hospitals ventilators ic units now lack medical personnel worry peak capability dealing hundreds thousands people may hospitals unprecedented action now deal unprecedented crisis bottom economic point view got say american people lose job going lose income trump can put fed can put trillion half banking system
bernie sanders,can protect wages worker america
joe biden,health organization offered offered testing kits us now refused buy get wanted best scientists america idea prepared thing point agree bernie situation now providing hospitals going needed needed now
joe biden,system handle surge sitting planning going put temporary hospitals can weve coronavirus weve excuse weve dealing viruses nh well happened africa provided hospitals dealing great pandemics people place go provide equipment protect responders
bernie sanders,jake honest understand coronavirus pandemic exposes incredible weakness dysfunctionality current healthcare system now spending per person healthcare people country gods happen people uninsured underinsured people watching program tonight say im feeling well go doctor cant afford go doctor am sick going cost thousands dollars treatment going feed kids major country earth guarantee healthcare all people
bernie sanders,spending money yet prepared pandemic dont doctors hospitals rural areas shutting people cant afford get prescription drugs bunch crooks running pharmaceutical industry ripping us single day ill now midst epidemic youve got people pharmaceutical industry oh wow opportunity fortune word got go president dont worry people america worry cost prescription drugs worry cost healthcare going get nation civilized democratic society rich poor middleclass get care drug companies rip us
joe biden,administration call meeting situation room all experts america dealing crisis sit exactly listen experts all due respect medicare all singlepayer system italy doesnt work medicare all solve problem all can care now making one pay treatment period crisis one pay drugs needed period crisis one pay hospitalization crisis period national emergency handled
joe biden,working italy now singlepayer system now regard fact position bring leading experts united states piecemeal sit ebola crisis needed one voice one voice day met crisis situation room lay all nation best proposal move forward absence governors making sound decisions best can going healthcare experts communities states move directed white house situation room laying detail ebola crisis
bernie sanders,well all dysfunctionality current healthcare system apparent earlier people hesitate go doctor going maze regulations well income income can get can get clearly prepared trump exacerbates crisis spend per capita healthcare nation one expect doctors all country one expect affordable prescription drugs one expect preparing effectively pandemic ready ventilators icus test kits
bernie sanders,bottom terms medicare all despite vice president experts us one reasons unprepared unprepared dont system got thousands private insurance plans system prepared provide healthcare all people good year epidemic losing people die year dont get doctor time clearly crisis making bad situation worse
joe biden,national crisis national crisis responding all free dont pay thing insurance policy crisis war virus war virus copays pass law pay period
bernie sanders,true matter fact true law enormous loopholes understand nancy pelosi best republicans prevented
bernie sanders,talking joe enormous loopholes fact covering treatment all people america people going stuck bill change going offer legislation fact change
joe biden,may offered legislation laid plan cover exactly covered house laid plan laid deal crisis pay crisis national emergency isnt question covered insurance treasury going pay national emergency
bernie sanders,weakness hypothetical family members diagnosed virus
bernie sanders,terrible tragedy massive anxiety wife virus husband wreck go psychologist get counseling doesnt money kid breaks leg dont money go healthcare now middle crisis year people died america didnt get healthcare dont universal coverage crisis one people america afford prescription drugs suffer die consider crisis bottom simple system exists canada exists countries all american get healthcare discussion can save huge sums money trick guts healthcare industry funding vice presidents campaign courage executives prescription drug industry
bernie sanders,funding campaign
joe biden,national crisis dont get terms politics ive laid plan building obamacare providing public option medicare cover way idea answer mistaken notion plan place crisis attacked abroad great consequence war war needed care people proposed laid detail terms dealing crisis free paid taxpayers generally generally bernies medicare all way
bernie sanders,well use all tools sense national guard folks new york state national guard clearly vice president indicated national emergency worry respond aggressively virus respond aggressively economic fallout global recession
bernie sanders,now illinois ohio memory correct governor closing bars closing restaurants workers millions workers may losing jobs got now trump can provide fed can provide trillion half liquidity banks weve got say worker america dont panic going youll pay mortgage going get check
bernie sanders,going
joe biden,answer call military
joe biden,now capacity provide surge help hospitals needed nation exactly prepared theyve ebola crisis theyve capacity build bed hospitals tents completely safe secure provide help get overflow national emergency call military
bernie sanders,well ebola crisis one thing pandemic far severe impactful country one things remember got lot elderly people country told stay dont leave house going get food get food youve got schools all country now shut going kids well crisis traumatized parents now stay kids cant go work
bernie sanders,bottom crisis got start paying attention vulnerable includes people prison now people homeless shelters now half people homeless tonight going respond now wall street bailout well people top bailed crooks wall street forgot suffering ordinary americans time let us learn lesson let us pay attention working families country
bernie sanders,vulnerable
joe biden,learned lesson lay detail now surging help places vulnerable single person nursing tested moving forces move capability sitting president sitting situation room now question going close well close get prescriptions filled close school children going get school food program going get mortgage paid propose all covered going multimultibillion dollar program things thing care now relating surging kind
joe biden,care now relating surging kind capability prevent great bump terms going pain well moving direction making longterm plan care
bernie sanders,well one consequences got learn lie american people frank nature crisis bothers president united states today mr trump praising china good work fact indicated lying people allowing inaudible case dont time recrimination punishing people now time way working china learning lot crisis fact got work weve got work health organization weve got work italy weve got work countries moment entire got support moment
joe biden,may respond insisted moment broke insist experts china china happening clear china consequences access lead ebola crisis bringing common plan all nations way virus depending exposure leadership international leadership bring insist fundamental change way approaching
bernie sanders,well bottom midst crisis got act unprecedented way country earth going country earth got work pharmaceutical industry big money interests time profiteering time all us working health organization strong organization sad president ignored international community ways including terms international health crisis
joe biden,clear clear united states going major major major bailout package reward corporations reward individuals fact put test problem policies administration economically weve eaten lot seed corn ability us use levers godawful tax cut trillion fact fed consequence now theyve leverage going level american people
joe biden,deal going deal crisis economic crisis critical now let people mortgages going paid rents going paid going childcare going all medical bills cared relating et cetera go going situation meeting daily basis middle financial crisis decide going find wherewithal money hold all folks harmless trump example got great idea well going
bernie sanders,ebola crisis view exposes dysfunctionality healthcare system prepared despite money spent ebola crisis exposing cruelty unjustness economy today income wealth inequality america today time years midst crisis multimillionaire happy crisis going get going get worried healthcare worried income coming
bernie sanders,half people living paycheck paycheck got people struggling working two three jobs put food table going happen lesson learned got move aggressively now address economic crisis result ebola talking ebola got ebola head now result virus coronavirus got understand fragility economy unjust unfair
joe biden,people revolution deal now can making badly hurt terms lose job terms ability care children terms healthcare costs crisis can now now put process system all
joe biden,legitimate concern income equality america real real affect us act swiftly thoroughly concert all forces bring bear deal crisis now thrown one loses mortgage one kicked house one loses paycheck one position financial disability consequence sars crisis
bernie sanders,well nation respond forcefully can current crisis good understanding got go future happen today wealthiest country history half people scared death good agree fact idea originally person country result crisis god crisis going going develop economy half people living paycheck paycheck struggling put food table
joe biden,dont disagree crisis going crisis now incredibly consequential millions millions americans going policy now going solved change deal healthcare got solved emergency now now thing healthcare us tools deal requires us go president terms planning secondly requires us position anticipating happen month weeks terms flow healthcare system bringing military hospital beds training equipment equipment save responders well
joe biden,addition today person laid today person doesnt income today tomorrow paycheck due get paycheck thirdly longterm deal making all badly damaged move move change economy ways profoundly people respond now things
bernie sanders,voted bailout believed illegal behavior people wall street rewarded bailout today way banks prosperous assets large bigger now time midst massive income wealth inequality people top surtax wealthy bail top bailout trillions dollars zero interest loans large banks
bernie sanders,answer question now stabilize economy cant repeat joe voted voted got save banks oil companies job now working person country matter income going suffer result crisis control
joe biden,banks all all people bernie cares deep trouble deep deep trouble all folks wed business theyd find position lose bank savings account saving economy save economy banks paid paid interest agree bernie jail big disagreement terms bailing question paid addition bailing automobile industry saving thousands jobs tens thousands jobs time voted well
bernie sanders,vote bailout money bush protect automobile industry point
bernie sanders,one minute one minute point terms bailout ways can bail handful people incredible wealth prospered illegal behavior individuals case wall street say secretary treasury bailout fine friends pay working people point joe billion tarp program fed trillions trillions dollars zero interest loans financial institution country central banks all essentially grant sell can bring interest rates greater zero interest loans got
joe biden,fact matter fact banks all great depression get now bernies guess hes going wealth tax top pay pay occurred talking tens hundreds billions dollars fact saved economy going depression passed recovery act one got three votes get changed billion thing us going great depression
joe biden,tested coronavirus coronavirus treated held harmless ive argued all woman crosses border beaten husband undocumented deported reports things deport undocumented person one interests folks xenophobic folks interest woman forward man forward deals keeping spread moving rapidly circumstances held accountable deported purpose period
bernie sanders,criticized proposal medicare all introduced includes making undocumented people covered now absurd situation undocumented people try thing sick go doctor dont spread disease now standing thinking ice going deport one things feels comfortable healthcare general principle coronavirus
bernie sanders,second all weve got terrible ice raids terrorizing communities all country thirdly answer question time long overdue country move comprehensive immigration reform path citizenship undocumented day one president restore legal status young people
bernie sanders,well great deal night fireside chat rally love rallies bring thousands people rallies enjoy now fact entire staff working personal level im shaking hands joe shake hands am careful people am interacting im lot soap hand sanitizers get infection say god now symptoms feel grateful
joe biden,well fortunately dont underlying conditions talked worry number one number two god time can happen mother say knock wood im good health number three im all precautions years old years old years old im going shake hands longer engage thing staff all working rallies longer virtual rallies virtual town hall meetings
joe biden,situation now encounter people going crowds im all precautions wash hands god times day hot water soap carry matter fact bag hand sanitizer dont times day use dont touch face im all precautions weve told
joe biden,problems solve now now whats revolution going disrupt senator talks medicare all hasnt told hes going get hasnt told fact possibility happening hadnt told going cost hadnt going apply doesnt kick years passes revolution act now pass biden healthcare plan takes obamacare restores all cuts subsidize provide lower drug prices hidden bills invest invest billion dealing underlying diseases great consequence diabetes alzheimers cancer
joe biden,medicare option public option providing medicare us can now can get passed can get im president united states america fundamental change now can experience consumer healthcare sons family all things weve people hope now years now bernie hasnt told us hes going pay
joe biden,talking trillion plan
bernie sanders,rarely congress media talk reality american life years despite huge increase productivity technology average worker todays making nickel real dollars years richest trillion increase wealth bottom half america billion decline wealth
bernie sanders,bottom half america billion decline wealth major country earth guarantee healthcare all people human major country paid medical family leave tax breaks billionaires halfamillion people homeless today jake dont talk power structure america power ill power people contribute money billionaires contribute money political campaigns control legislative agenda people power
bernie sanders,real changes country create economy works all guarantee quality healthcare all billion profit healthcare industry wall street drug companies insurance companies fossil fuel industry dont campaign contributions create economy works all
joe biden,proposed years ago federally fund all elections healthcare plan changing way deal capital gains people pay capital gains based income tax raise billion pay entire medical healthcare plan cover
joe biden,fact matter call pay supported exorbitant tax cuts wealthy opposed tax cut president put trillion billion time all eliminate safety net
joe biden,idea bernie implies way things speaking negative ads lord bernie running ads im opposed social security politifact flat lie washington post flat lie
bernie sanders,oh well let ask question joe
bernie sanders,floor senate senate years
bernie sanders,time time talking necessity pride cutting social security cutting medicare cutting veterans programs
bernie sanders,all america go website now go youtube now time time fan bowlessimpson
bernie sanders,fan balanced budget amendment called cuts social security joe
bernie sanders,honest guy dont truth all mistakes
joe biden,am telling truth fact am rated social security organizations am viewed strong
joe biden,laid increase social security benefits
bernie sanders,good laid
joe biden,laid am going fact paid
joe biden,go joebidencom exchange paul ryan desire try privatize andor cut social security understand manipulated
bernie sanders,all joe let repeat straight american people am floor senate time time talking cut social security medicare veterans programs true true
joe biden,true true terms negotiations place deal deficit table support cuts social security veterans benefits
bernie sanders,whoa whoa whoa table all including judgment cuts social security veterans
joe biden,order get kinds changes things cut vote
bernie sanders,people helped joe contradict
bernie sanders,joe contradicted one minute excuse one minute floor minute say well yes reason worried deficit good reason all am prepared cut advocated cuts programs
joe biden,voted cut social security
bernie sanders,im talking voting joe
joe biden,voted well voted protect go debate paul ryan vice presidency bernie acknowledge campaign context exchange paul ryan politifact wrong
bernie sanders,yeah well washington post politifact wrong lot times
joe biden,wrong bernie wrong bernie
bernie sanders,joe wait minute ill answer question answer mine
bernie sanders,one time floor time time reason talking cut social security medicare veterans programs
joe biden,talk cut programs
bernie sanders,all say american people go youtube all place joe times im surprised can defend change mind cant deny reality
bernie sanders,incremental adjustments advocated adjustments advocated advocated years things increasing cost living assistance going find calling cuts social security now example determine colas inflation general population segregating higher costs seniors paying prescription drugs healthcare talking
bernie sanders,fact joe enamored socalled bowlessimpson effort included cuts social security raising retirement age formed people barbara boxer defending social security caucus say seniors get year going cut social security
joe biden,two things number one talk bankruptcy bill bankruptcy bill passing overwhelmingly improved choice going pass republican president republican congress offered two amendments people women children go front alimony support payments passed overwhelmingly rest bill improved number one
joe biden,number two ive talked senator warren proposal opportunity weve substantial change get republican administration talked two nights ago supported proposal good proposal solid proposal get credit introduced
joe biden,regard talking terms college education ive long time position years education st century years education exact bill senator sanders introduced guess year ago capping income get free point youd pay college education worked public schools work public universities state support idea good idea support im bernies wrong one
bernie sanders,bit leadership well joe talked bankruptcy joe memory correct helped write bankruptcy bill
bernie sanders,bankruptcy bill way talk education got people america struggling student debt struggling student debt bankruptcy bill impossible difficult people escape student debt bad bill joe majority people senate voted
bernie sanders,overwhelmingly well voted house dont rethink position leadership guts unpopular vote bankruptcy difference joe higher education years ago popular idea joe glad coming now years ago public colleges universities tuition free people bernie radical idea well got states cities counties all country moving direction
bernie sanders,im glad joe board leadership going forward popular idea get criticized im fact im leadership issues joe campaign talked raising minimum wage bucksanhour years ago joe
joe biden,campaigned
joe biden,hour new york city go governor
bernie sanders,talk governor am aware am aware
bernie sanders,all years ago radical idea people congress talking
joe biden,well get straight bankruptcy bill bankruptcy bill affect student debt law passed declare bankruptcy loans private institutions bankruptcy bill affect people bankruptcy bill student loans number one
joe biden,number two now position correct problem fact hadnt stepped changed law relates people making alimony child support guess bucket going pass let finish incrementally better bill support bill clear industry didnt bill
joe biden,number two bill now calls opportunity fundamentally change mistakes correct bill time support elizabeth warrens idea good idea
bernie sanders,well kind circular logic going reform bill voted well hadnt voted rallied people house voting problems today leadership joe deals opposition support say legislation gay communities socalled defense marriage act remember bill remember
bernie sanders,gay marriage today considered bit differently years ago remember vote hard vote voted defense marriage act voted voted bankruptcy bill voted voted war iraq tough vote voted voted disastrous trade agreements nafta pnt all china costs country good paying jobs voted voted hyde amendment denies low income women get abortion consistently voted dont position today consistently voted all im can argue merits bill
bernie sanders,takes courage thing
joe biden,can argue future man voted brady bill times background checks background checks times number one number two man one democrats voted exempt gun industry sued talk special special interest sue drug companies sue tobacco companies sue gun manufacturers voted years ago mistake now im prepared accept mistake
joe biden,question point way add im person go national television administration say supported gay marriage supported gay marriage asked started ripple gay marriage national television
bernie sanders,argue bill im suggesting time crisis live unsettling economically healthcare prospective coronavirus people america record
bernie sanders,years stood working families country special interest white house record joes
joe biden,record mine
bernie sanders,totally record all manifested campaign all money wealthy people billionaires white house life
bernie sanders,special interest im candidate
joe biden,average campaign contribution
joe biden,hes making hard now credit things credit things clear bernie nominee support campaign people support thing existential threat united states america donald trump critical hope bernie thing am nominee encourage all followers fact support well bigger us character nation ballot well senator sanders agree medic healthcare privilege agree deal student debt agree deal education access education agree new green deal deal existential threat faces humanity disagree detail dont disagree principle fundamentally disagree president man cut social security cut medicare bernie president united states bigger im nominee bernies nominee defeat donald trump years donald trump fundamentally change nature nation weve got restore countrys soul essential long president going
bernie sanders,can say word ill respond
bernie sanders,day one announced candidacy country deal president pathological liar running corrupt administration doesnt constitution united states believes hes law racist sexist homophobe dangerous president modern history country
bernie sanders,day one joe day one hope win nomination dont win nomination democratic candidate prepared humanly defeat donald trump
bernie sanders,let respond joe talk green new deal all things general terms details difference campaign dont ive heard say yet joe going save planet kids future generations courage greed fossil fuel industry clear shortterm profits future planet detailed planet detailed proposal happy get endorsement sunrise movement
bernie sanders,cabinet administration america heard half people america women representation cabinet administration terms policies joe consistently believed lifetime voting record groups naral womens control body government believed got move aggressively deal domestic violence country aggressively effectively case women america earning cents dollar compared men minority woman cents dollar
