bernie sanders,universal affordable highquality childcare women single married can go work kids going well care agenda berniesanderscom find strong agenda fighting rights women today incredible political assault trump republican governors all country
joe biden,yes number one agree question underlying premise amys question number one commit im elected president opportunity appoint courts ill appoint black woman courts required representation now long overdue secondly im elected president cabinet administration country commit ill pick woman vice president number women qualified president tomorrow pick woman vice president
joe biden,number three im guy wrote domestic violence law im guy put prohibitions one abuses gun period gun get boyfriend exception amended now ive get stay order court child gun one gun abused woman period
bernie sanders,ask joe question now womans control body massive assault unprecedented assault
bernie sanders,joe one occasion voted hyde amendment woman lowincome woman use medicaid funding abortion view modified
joe biden,view view way congress voted hyde amendment one point locked bills reason affirmatively opposed hyde amendment going public funding all healthcare way allow requirement hyde amendment woman doesnt money coverage healthcare
joe biden,number two ago number one number two send desk united states congress im elected president im elected president codification roe v wade amended casey womans choose womans opportunity decision fact ive rating naral well
bernie sanders,excuse lifetime voting record naral
joe biden,record late naral dont years ago
bernie sanders,well all one differences pick bone consistent ive believed im glad youve changed views
bernie sanders,all likelihood nominating woman making progressive women progressive women strong tendency move direction
joe biden,number one long get president get daca well making protect parents well way moving immigration bill well fact vote immigration bill way bernie voted immigration bill voted forward passed wed undocumented citizens speak now send desk bill requires access citizenship undocumented folks number one number two days administration one one deported all point deportations place commissions felonies united states america
joe biden,uniting families making can nation immigrants well nation decent
bernie sanders,let respond ill answer question let respond joes comments immigration bill bill opposed lulac largest latino organization america southern poverty law center called guestworker programs akin slavery vote bill killed vote dorgan amendment voted one joe barack obama understood proposal bad idea dont slavery america workers guestworkers forced say employers
bernie sanders,terms immigration general let outline things day one restore legal status young people parents daca program number two ice raids terrorizing communities all country three changed border policy administration federal agent grab babies arms mothers fourth can pass american people comprehensive immigration reform path citizenship undocumented
bernie sanders,trump total lie talking humane sensible policy supported american people talking open borders course trump lies bottom now country people decades working hard raising kids agricultural economy construction economy good people yet living terror got terror ice raids move path citizenship
joe biden,let set record straight idea slavery barack obama supported immigration bill teddy kennedy supported immigration bill supported doubt people slavery way vote lou dobbs continued canard jobs immigrants jobs americans one republican canards vote ted kennedy slavery slavery people voted slavery
joe biden,regard question relative deal supporting border can deal securing border national technical all bad things coming ports entry now dont wall way president surge border notion time history people seeking asylum squalor side river desperate situation united states judgment qualify surge border immigration judges decisions one one put jail waiting hearing
bernie sanders,kind ive entire campaign
bernie sanders,border hundreds administrative judges deal people seeking asylum based international law dividing children parents dividing families humane border policy ill speak son immigrant father country poland age nickel pocket speak english didnt education day one demonization ugly demonization white house immigrant community country weve got president divide us administration brings people black white latino native american asian american
bernie sanders,course one things process psychological terror ive talked kids kids scared death america school mom dad may may deported day one ice raids harmful people american people us im son immigrant country built immigrant labor built slave labor got appreciate demonization divisiveness coming trump administration
joe biden,can add one thing
joe biden,nation immigrants future rests latino community fully integrated children school today kindergarten high school latino now today idea american thinks doesnt pay us invest future absolutely bizarre notion invest wealthy concerned xenophobes concerned fact get worse better embracing bringing happened irish immigrants famine happened italians et cetera weve xenophobia disease
bernie sanders,well course scientists telling us scientists point jake telling us dont get act years irreversible damage planet talking cities america miami new orleans charleston south carolina underwater talking severe droughts prevent farmers midwest growing food talking extreme weather disturbances hit houston texas venice italy months ago
bernie sanders,talking absolute hear joes position middle ground thing building solar panels wind turbines transforming energy system humanly can fossil fuel insane continue fracking america absurd tens billions dollars year tax breaks subsidies fossil fuel industry got now love kids future generations
joe biden,thing president obama summoned state department excuse defense department meet all chiefs single greatest threat national security climate change single greatest threat national security populations move can longer live islands sinking saw happened darfur change weather patterns deserted war great migrations great migrations single biggest problem number two awful lot people today fact ill changes environment bernie lives im northeast beetle infestation range things causing diseases well addition eliminating foliage
joe biden,yes ambitious tackle crisis go joebidencom lay things elected number one going reinstate all cuts president cafe standards far automobiles can go investing light rail cars road making position now position put charging stations areas silence all new highways built making spent billion year silence federal government paying transportation vehicles all converted low carbon fuel andor carbon fuel all move direction all carbon free can things can lay tracks can changed president president one
joe biden,addition rejoin paris climate accord helped put call nations nations major polluters united states days ante clear fact didnt price pay lastly now organizing hemisphere provide billion amazon brazil longer burn amazon forests longer forests farming say going region burning admit one entire year per year
bernie sanders,all well good mentioned started debate talking warlike situation terms coronavirus act act dramatically boldly going save lives country climate change exactly way question reentering paris accord fine cares big deal deal now courage point im all night long healthcare industry profits healthcare all fossil fuel industry
bernie sanders,terms fossil fuel industry guys lying theyve lying years tobacco industry lied years ago oh dont fossil fuels oil carbon emissions causing climate change knew exxonmobil knew lied fact held criminally accountable jake issue enormous consequence joe question money minute time talk shaking event
joe biden,number one subsidies fossil fuel industry drilling federal lands drilling including offshore ability oil industry continue drill period ends number one number two situation well move rapidly change dynamic terms can set motion fact climate change paris accord doesnt get exactly problem problem can deal internationally can bring can move direction fact violate commitment pay economic price whats happening china exporting coal coal
bernie sanders,paris accord doesnt go laughing joe missing point
bernie sanders,existential crisis
bernie sanders,talk im talking stopping fracking can im talking telling fossil fuel industry going destroying planet ifs buts maybes im talking speaking
bernie sanders,china well im proposal im talking speaking china russia countries all moment making point spending trillion weapons destruction designed kill pool resources fight common enemy climate change heart place requires dramatic bold action weve got fossil fuel industry plan
joe biden,plan takes fossil fuel industry unites got finished whats going hes going bring countries making clear im bring live commitments dont live commitments pay financial price pay economic price can state three feet sea level dont lecture whats going happen rising seas watched delmarva peninsula south carolina rest bit wrote climate change bill congress politifact game changer im guy dick lugar going trade well forgive debt dont cut fars ive way ahead curve idea all sudden bernie amazing
bernie sanders,bernie didnt find bernie listening scientists talking making countries fulfill commitments commitments moment joe scientists telling us underestimated severity crisis wrong problem severe all im fighting future planet wellbeing kids future generations continue understand joe believes continue fracking correct im wrong now bringing fossil fuel industry going move aggressively win solar sustainable energies
joe biden,new fracking way recovery act invested billion making brought price solar wind lower price coal new coal plant built watching number one number two situation fact ability lay tracks one can change dynamic talking things ive talking years high speed rail millions automobiles road making move direction drilling federal lands making invest changing entire fleet
joe biden,united states military
bernie sanders,invest unprecedented way unprecedented way started talking trillion investment lot money ive criticized dont alternative playing future planet weve got dramatic dramatic massive investments wind solar sustainable energies general development making buildings all country state vermont country got lot old buildings can put millions
bernie sanders,opposed authoritarianism cuba saudi arabia china russia life record president united states democracy authoritarianism cuba place
bernie sanders,now faced global crisis movement authoritarianism putin russia leading mbs saudi arabia leading president united states donald trump put flag say country got move democracy human rights view view
bernie sanders,well can point china china undoubtedly authoritarian society deny economists deny extreme poverty china today years ago fact condemn authoritarianism china russia cuba place simply say administrations positive impact people incorrect
joe biden,change cuban policies cuban people get thumb castro brother change policy can impact cubas policy opened praising sandinistas praising cuba praising now china china authoritarian dictatorship deal
joe biden,idea fact increased wealth people country marginal change place uyghurs muslims prison camps west whats happening hong kong today way idea praised soviet union soviet union things well awful dictatorship killing millions millions people
joe biden,addition circumstance election all knew russians now interfering elections man voted sanctioning russia interference elections
bernie sanders,well dont get exactly problem politics all question china progress extreme poverty years
joe biden,jack ripper
bernie sanders,joe problem
bernie sanders,problem cant talk political understand chinas terrible awful good inaudible fact matter china course authoritarian state
bernie sanders,minutes ago way question asked quoted barack obama president obama generous praise cuba healthcare education talking program years ago year castro revolution
bernie sanders,bottom bit absurd going way course opposed authoritarian way considered good policy good idea condemning dictatorship saudi arabia lot people washington
bernie sanders,condemning dictatorship uae
joe biden,idea occasionally nice country one thing idea praising country violating human rights fact allies wonder whats going south koreans praises china australians shadow china happening indonesia shadow china happening terms japan shadow china matter flat dictators period called straight may work
joe biden,example help negotiate new start agreement russia putin guy thug
joe biden,learned cant word president fact assured use force remember context context united nations security council going vote insist allow inspectors determine fact producing nuclear weapons weapons mass destruction
joe biden,whats thing happened got elected president obama turned get troops hours responsible combat troops iraq admitted years ago spect trusted im prepared compare foreign policy credentials friend day week day week
bernie sanders,start war iraq joe house understood way clear vote signing ceremony bush knew voted resolution bush authority go war knew exactly cheney wanted
bernie sanders,people issue closely understood bush administration lying teeth regard saddam weapons mass destruction understood floor house time time issue war iraq long time ago issue trade agreement easy lead effort disastrous trade agreements
bernie sanders,issue bankruptcy bill supported issue hyde amendment issue defense marriage act issue difficult times god difficult times going courage powerful special interest whats working families country
joe biden,vote sanction russians
bernie sanders,talking iran tied iran russia iran john kerry indicated support undermining iranian agreement
bernie sanders,reason condemned russia time time
joe biden,fact idea fact supported things suggested accurate im guy helped put iran deal got inspectors chief staff guy foreign policy guy negotiation guy helped put nation organization isis iraq syria ive dealt folks good guys bad guys
joe biden,fact bernies notion embraces folks sandinistas cuba soviet union talks good things china absolutely contrary message send rest
bernie sanders,led effort all forms authoritarianism including americas socalled allies uae saudi arabia fact may worked conservative republicans utilize time war powers act get united states horrific war yemen led saudi arabia view moving authoritarianism united states got leader people all us guidance
joe biden,well message resonated board single state weve turnout virginia turnout voted didnt bring brought number two whats happened mississippi whats happened north carolina whats happened washington state whats happening board im winning all places whats reason whats reason reason am democrat capital d fact believes base base democratic party hardworking men women fact high school educated african americans minorities including hispanics all minorities suburban women people fact sense place am winning winning overwhelmingly winning close places
bernie sanders,happening point decided president imperative defeat trump campaign biracial bigenerational multigenerational grassroots movement way now won states joe won states winning winning ideological struggle states mississippi joe won major victory turns pretty good majority folks medicare true state country
bernie sanders,issue dont talk winning generational struggle depending state winning people years age younger big time people years age younger frankly doubts
bernie sanders,lose thing joe wins joe doubts win general election trump tough opponent energy excitement largest voter turnout history going bring young people great voters dont vote kinds numbers political process going bring latinos great people agenda dont vote numbers doubts vice president bidens campaign can generate energy excitement voter turnout
joe biden,way get straight energy excitement place far turnout increased virginia can go list coming didnt money compete man states virtually money press biden money net money idea reason understand happen
joe biden,way idea supports medicare all hadnt indicated going cost people hes yet exactly whats going point people dont detail all fact am winning
joe biden,overwhelmingly democratic constituencies board
bernie sanders,well hearts go move aggressively person country virus thinks virus understands get all healthcare americans move aggressively test kits ventilators icu units medical personnel
bernie sanders,jake say moment economic uncertainty addition coronavirus time ask get lack preparation virus economy people hurting time massive income wealth inequality time ask question power america owns media owns economy owns legislative process tax breaks billionaires raise minimum wage
bernie sanders,pump oil industry half people homeless america time move aggressively dealing coronavirus crisis deal economic fallout time rethink america create country care nation greed corruption place corporate elite
joe biden,number one outset cant imagine people going now lost cant imagine people going mom example good friend sitting window nursing mom cant go sign language mom window talk guess can imagine fear concern people number one one things understand all hands deck jake outset bigger individual bigger america bring people kind sacrifices get foremost start listen science
joe biden,met id today id sitting situation room literally day outset crises white house pulling best people united states say prescriptive moves now lessen virus beat go point can save lives get people tested get people kind care
joe biden,economic impact fact rendered harmless fact paycheck met paycheck people going people homes dont mortgage payments dont rent payments making going care education way education systems closing now things
joe biden,addition best science telling us can stay open closed earlier idea closing schools understand provide lunches people fact school lunch program get idea close place can understand decision close places people gather open drug store can get prescription deal things going whats way national standard coming situation room now
joe biden,way single thing can deal larger problem road income inequality get rid donald trump donald trump hes exacerbated single one problems urgent going hold people harmless damage consequence virus
